{
  "$schema": "../../../../../schemas/agent-deliverable.schema.json",
  "schema_version": "1.0.0",
  "workflow_version": "blueprint-cinema-1.0",
  "work_order_id": "avatar-v5-question-output-review",
  "episode_folder": "EP007-exit-readiness-prep",
  "input_hashes_used": [
    {
      "path": "blueprint-cinema/experiments/EP007-PRESENTER-001/avatar-v5-gestures/ACCEPTANCE.json",
      "sha256": "f86d47e5ace325068d3cb2384cf03933b80c30bca0866719b60c0f5e32fc224f"
    },
    {
      "path": "blueprint-cinema/experiments/EP007-PRESENTER-001/avatar-v5-gestures/media/gesture-review.mp4",
      "sha256": "b896fcd06c0b2b15dfd16dad18e80f9aa1971e916b5a9b06d52ee09874f3f918"
    },
    {
      "path": "blueprint-cinema/experiments/EP007-NET-NEW-UNFINISHED-ANSWER-003/hyperframes/reviews/r31-avatar-v5-wide/provider/v5-question/native.mp4",
      "sha256": "62872b9d467b6b6591cea5e37ce93fb4387e77b26efd3675ba3877690e0475cd"
    },
    {
      "path": "blueprint-cinema/experiments/EP007-NET-NEW-UNFINISHED-ANSWER-003/hyperframes/reviews/r31-avatar-v5-wide/provider/v5-question/native-qa.json",
      "sha256": "a78fbc5d0003eb4dd0acfa851bb18416c18419c2a14438dcb6b3dd54b202560f"
    },
    {
      "path": "blueprint-cinema/episodes/EP007-exit-readiness-prep/agents/deliverables/avatar-v5-current-cut-preparation/prompts/v5-question.txt",
      "sha256": "fb8a4a8b62e26328d18f3dc014ad6b1b3fa55b88e8fd9098e335e8e8ec2d6883"
    },
    {
      "path": "blueprint-cinema/episodes/EP007-exit-readiness-prep/agents/work-orders/avatar-v5-question-output-review.json",
      "sha256": "3d986fa56f6a99a028e556adf9fae56d77a64bb803c0f9c50e2e7a58d42bcbe8"
    }
  ],
  "files_produced": [
    "blueprint-cinema/episodes/EP007-exit-readiness-prep/agents/deliverables/avatar-v5-question-output-review/accepted-v5-overview.jpg",
    "blueprint-cinema/episodes/EP007-exit-readiness-prep/agents/deliverables/avatar-v5-question-output-review/deliverable.json",
    "blueprint-cinema/episodes/EP007-exit-readiness-prep/agents/deliverables/avatar-v5-question-output-review/evidence.json",
    "blueprint-cinema/episodes/EP007-exit-readiness-prep/agents/deliverables/avatar-v5-question-output-review/inspect-native.py",
    "blueprint-cinema/episodes/EP007-exit-readiness-prep/agents/deliverables/avatar-v5-question-output-review/question-early-middle.jpg",
    "blueprint-cinema/episodes/EP007-exit-readiness-prep/agents/deliverables/avatar-v5-question-output-review/question-hand-detail.jpg",
    "blueprint-cinema/episodes/EP007-exit-readiness-prep/agents/deliverables/avatar-v5-question-output-review/question-late-ending.jpg",
    "blueprint-cinema/episodes/EP007-exit-readiness-prep/agents/deliverables/avatar-v5-question-output-review/report.md"
  ],
  "checks": [
    {
      "command": "Verify all five issued artifact SHA-256 pins and the work-order identity",
      "outcome": "pass"
    },
    {
      "command": "Independent source probes and native full FFmpeg decode",
      "outcome": "pass"
    },
    {
      "command": "Inspect nine accepted V5 positions against29 native positions and15 enlarged hand samples",
      "outcome": "pass"
    },
    {
      "command": "Record native identity/framing/anatomy observations, gesture/rest phases, repetition watchpoint, and12\u201313second endpoint",
      "outcome": "pass"
    },
    {
      "command": "Uninterrupted real-time performance review and final original-audio lip synchronization",
      "outcome": "not_run"
    },
    {
      "command": "Owner acceptance or canonical gate advancement",
      "outcome": "not_run"
    }
  ],
  "sources_and_provenance": [
    "Exact work-order inputs, current V5 acceptance, native source and exact question prompt",
    "Local FFmpeg probe/decode and sampled-frame contact sheets; no external media acquisition",
    "OE Video Direction presenter-reference contract and Blueprint Cinema REVIEW-QA severity/evidence rules",
    "Native speech is regenerated; root owns original-narration restoration and final integration"
  ],
  "assumptions": [
    "Owner-accepted V5 hand activity and brief eye movement remain the baseline for this review",
    "Frame samples can reveal visible anatomy/framing/action phases but not certify motion between samples",
    "The native mouth endpoint cannot establish the restored output endpoint"
  ],
  "unresolved_questions": [
    "Whether recurring small paired hand lifts feel conversational at normal speed",
    "Whether restored lips supply a natural finished hold around the intended source12second outgoing cut",
    "Final synchronized performance and owner acceptance remain pending"
  ],
  "external_writes": false,
  "paid_services": false,
  "synthetic_generation": false,
  "approval_claimed": false,
  "production_state_changed": false,
  "status": "complete"
}
