{
  "$schema": "../../../../../schemas/agent-deliverable.schema.json",
  "schema_version": "1.0.0",
  "workflow_version": "blueprint-cinema-1.0",
  "work_order_id": "r38-visual-direction-built-qa",
  "episode_folder": "EP007-exit-readiness-prep",
  "input_hashes_used": [
    {
      "path": "blueprint-cinema/experiments/EP007-NET-NEW-UNFINISHED-ANSWER-003/hyperframes/reviews/r38-progressive-business/compositions/owner-dependency.html",
      "sha256": "d1916a7c1c32dcb7a8dc3ce36a25c81028468944f1746c9644f7decac6954aea"
    },
    {
      "path": "blueprint-cinema/experiments/EP007-NET-NEW-UNFINISHED-ANSWER-003/hyperframes/reviews/r38-progressive-business/qa/CONTACT-V2.jpg",
      "sha256": "96e471b5773bc771134aa17d5d289898c8c0d9b42f401497ea09f87dc5879659"
    },
    {
      "path": "blueprint-cinema/experiments/EP007-NET-NEW-UNFINISHED-ANSWER-003/hyperframes/reviews/r38-progressive-business/public/art/r38-bench.svg",
      "sha256": "4fa38d2cfa23ee8a5427380ca8eaf40d82ac3fd958532c5af69b47ba1af6ae58"
    },
    {
      "path": "blueprint-cinema/experiments/EP007-NET-NEW-UNFINISHED-ANSWER-003/hyperframes/reviews/r38-progressive-business/public/art/r38-routine.svg",
      "sha256": "d0491589c7023e20dd248d6589b59c0ebb785d30b0add201a2b1d35717406de6"
    },
    {
      "path": "blueprint-cinema/experiments/EP007-NET-NEW-UNFINISHED-ANSWER-003/hyperframes/reviews/r38-progressive-business/public/art/r38-inbox.svg",
      "sha256": "33ac2339d223d37e828d85560a573dc1bead19d1cd6d840c858232354dfe247e"
    },
    {
      "path": "blueprint-cinema/experiments/EP007-NET-NEW-UNFINISHED-ANSWER-003/hyperframes/reviews/r38-progressive-business/public/art/r38-outbox.svg",
      "sha256": "978b6d4bd6112ffe68160240dff7873af38fda696ef3c7ac9bcecff4617b3f88"
    }
  ],
  "files_produced": [
    "blueprint-cinema/episodes/EP007-exit-readiness-prep/agents/deliverables/r38-visual-direction/built-candidate-qa.md"
  ],
  "checks": [
    {
      "command": "Read actual R38 timeline and inspect CONTACT-V2 and causal SVG geometry",
      "outcome": "pass"
    },
    {
      "command": "Validate standard agent deliverable schema",
      "outcome": "pass"
    },
    {
      "command": "Review full encoded motion or restored avatar performance",
      "outcome": "not_run"
    }
  ],
  "sources_and_provenance": [
    "Only the listed local candidate inputs were used. CONTACT-V2 precedes the root-reported footer correction.",
    "No runtime edits or existing deliverable rewrites were performed."
  ],
  "assumptions": [
    "The callback and presenter placeholders are intentionally pending and are not being represented as finished."
  ],
  "unresolved_questions": [
    "Opaque paper fill is recommended for the critical routine book; an encoded frame must verify that its identity remains readable.",
    "Final footer position and full audiovisual motion were not independently verified by this bounded QA."
  ],
  "external_writes": false,
  "paid_services": false,
  "synthetic_generation": false,
  "approval_claimed": false,
  "production_state_changed": false,
  "status": "complete"
}
